{"assignment_master_key_status":"unrevealed","assignment_program":{"contract_id":"registered-assignment-program-v1","domains":["swe_multilang","tau2"],"draw_contract":"assignment-master-key-derived-frame-v1","matching_algorithm":"frozen-prefix-paired-matching-v1"},"input_lock_sha256":"7bb584da29f1fb55e5f46133a985bd3c249f154643dad5a3469ae737aee497e7","record_kind":"cloud_official_assignment_pending","roster_candidate_sha256":"215bd2e7acb352c8d1c0c79dbd4863176fc689b7c450a4afaffcc30bf2e119c6","schema_version":"0.1.0","sealed_assignment_ref":null,"status":"pending_live_authority","study_id":"neurips-2026-resampling-null","synthetic_substitute_forbidden":true}
